#Accession	Length	Protein_name	Protein_name_alternative	Gene_name	Organism_scientific	Organism_common	Function
P05019	195	Insulin-like growth factor I	Mechano growth factor (MGF) / Somatomedin-C	IGF1	Homo sapiens	Human	The insulin-like growth factors, isolated from plasma, are structurally and functionally related to insulin but have a much higher growth-promoting activity. May be a physiological regulator of [1-14C]-2-deoxy-D-glucose (2DG) transport and glycogen synthesis in osteoblasts. Stimulates glucose transport in bone-derived osteoblastic (PyMS) cells and is effective at much lower concentrations than insulin, not only regarding glycogen and DNA synthesis but also with regard to enhancing glucose uptake. May play a role in synapse maturation (PubMed:21076856, PubMed:24132240). Ca(2+)-dependent exocytosis of IGF1 is required for sensory perception of smell in the olfactory bulb (By similarity). Acts as a ligand for IGF1R. Binds to the alpha subunit of IGF1R, leading to the activation of the intrinsic tyrosine kinase activity which autophosphorylates tyrosine residues in the beta subunit thus initiatiating a cascade of down-stream signaling events leading to activation of the PI3K-AKT/PKB and the Ras-MAPK pathways. Binds to integrins ITGAV:ITGB3 and ITGA6:ITGB4. Its binding to integrins and subsequent ternary complex formation with integrins and IGFR1 are essential for IGF1 signaling. Induces the phosphorylation and activation of IGFR1, MAPK3/ERK1, MAPK1/ERK2 and AKT1 (PubMed:19578119, PubMed:22351760, PubMed:23696648, PubMed:23243309).
P05230	155	Fibroblast growth factor 1	Acidic fibroblast growth factor (aFGF) / Endothelial cell growth factor (ECGF) / Heparin-binding growth factor 1 (HBGF-1)	FGF1	Homo sapiens	Human	Plays an important role in the regulation of cell survival, cell division, angiogenesis, cell differentiation and cell migration. Functions as potent mitogen in vitro. Acts as a ligand for FGFR1 and integrins. Binds to FGFR1 in the presence of heparin leading to FGFR1 dimerization and activation via sequential autophosphorylation on tyrosine residues which act as docking sites for interacting proteins, leading to the activation of several signaling cascades. Binds to integrin ITGAV:ITGB3. Its binding to integrin, subsequent ternary complex formation with integrin and FGFR1, and the recruitment of PTPN11 to the complex are essential for FGF1 signaling. Induces the phosphorylation and activation of FGFR1, FRS2, MAPK3/ERK1, MAPK1/ERK2 and AKT1 (PubMed:18441324, PubMed:20422052). Can induce angiogenesis (PubMed:23469107).
P05362	532	Intercellular adhesion molecule 1	Major group rhinovirus receptor	ICAM1	Homo sapiens	Human	ICAM proteins are ligands for the leukocyte adhesion protein LFA-1 (integrin alpha-L/beta-2). During leukocyte trans-endothelial migration, ICAM1 engagement promotes the assembly of endothelial apical cups through ARHGEF26/SGEF and RHOG activation. (Microbial infection) Acts as a receptor for major receptor group rhinovirus A-B capsid proteins. (Microbial infection) Acts as a receptor for Coxsackievirus A21 capsid proteins. (Microbial infection) Upon Kaposi's sarcoma-associated herpesvirus/HHV-8 infection, is degraded by viral E3 ubiquitin ligase MIR2, presumably to prevent lysis of infected cells by cytotoxic T-lymphocytes and NK cell.
P06804	235	Tumor necrosis factor	Cachectin / TNF-alpha / Tumor necrosis factor ligand superfamily member 2 (TNF-a)	Tnf	Mus musculus	Mouse	Cytokine that binds to TNFRSF1A/TNFR1 and TNFRSF1B/TNFBR. It is mainly secreted by macrophages and can induce cell death of certain tumor cell lines. It is potent pyrogen causing fever by direct action or by stimulation of interleukin-1 secretion and is implicated in the induction of cachexia, Under certain conditions it can stimulate cell proliferation and induce cell differentiation (By similarity). Induces insulin resistance in adipocytes via inhibition of insulin-induced IRS1 tyrosine phosphorylation and insulin-induced glucose uptake. Induces GKAP42 protein degradation in adipocytes which is partially responsible for TNF-induced insulin resistance (PubMed:25586176). Plays a role in angiogenesis by inducing VEGF production synergistically with IL1B and IL6 (By similarity). The TNF intracellular domain (ICD) form induces IL12 production in dendritic cells.
P07942	1786	Laminin subunit beta-1	Laminin B1 chain / Laminin-1 subunit beta / Laminin-10 subunit beta / Laminin-12 subunit beta / Laminin-2 subunit beta / Laminin-6 subunit beta / Laminin-8 subunit beta	LAMB1	Homo sapiens	Human	Binding to cells via a high affinity receptor, laminin is thought to mediate the attachment, migration and organization of cells into tissues during embryonic development by interacting with other extracellular matrix components. Involved in the organization of the laminar architecture of cerebral cortex. It is probably required for the integrity of the basement membrane/glia limitans that serves as an anchor point for the endfeet of radial glial cells and as a physical barrier to migrating neurons. Radial glial cells play a central role in cerebral cortical development, where they act both as the proliferative unit of the cerebral cortex and a scaffold for neurons migrating toward the pial surface.
P07996	1170	Thrombospondin-1	Glycoprotein G	THBS1	Homo sapiens	Human	Adhesive glycoprotein that mediates cell-to-cell and cell-to-matrix interactions. Binds heparin. May play a role in dentinogenesis and/or maintenance of dentin and dental pulp (By similarity). Ligand for CD36 mediating antiangiogenic properties. Plays a role in ER stress response, via its interaction with the activating transcription factor 6 alpha (ATF6) which produces adaptive ER stress response factors (By similarity).
P08721	317	Osteopontin	Bone sialoprotein 1 / Secreted phosphoprotein 1 (SPP-1)	Spp1	Rattus norvegicus	Rat	Major non-collagenous bone protein that binds tightly to hydroxyapatite. Appears to form an integral part of the mineralized matrix. Probably important to cell-matrix interaction. Acts as a cytokine involved in enhancing production of interferon-gamma and interleukin-12 and reducing production of interleukin-10 and is essential in the pathway that leads to type I immunity.
P08833	259	Insulin-like growth factor-binding protein 1	Placental protein 12 (PP12)	IGFBP1	Homo sapiens	Human	IGF-binding proteins prolong the half-life of the IGFs and have been shown to either inhibit or stimulate the growth promoting effects of the IGFs on cell culture. They alter the interaction of IGFs with their cell surface receptors. Promotes cell migration.
P0C6B6	484	Zinc metalloproteinase homolog-disintegrin albolatin	?	?	Trimeresurus albolabris	White-lipped pit viper	The function of this complete protein has not been studied, but it may be similar to the function of the disintegrin domain. A recombinant protein of this domain (409-484) inhibits collagen-induced human platelet aggregation, without having effect on ADP-induced aggregation. It may act either by blocking the binding of fibrinogen to the platelet receptor GPIIb/GPIIIa (ITGA2B/ITGB3) or by blocking the binding of collagen to the integrin alpha-2/beta-1 complex (ITGA2/ITGB1).
P0C6E2	41	Disintegrin viperistatin	?	?	Daboia palaestinae	Palestine viper	Potent and highly selective inhibitor of alpha-1/beta-1 (ITGA1/ITGB1) integrin binding to collagen I and IV. Is about 25-fold more potent than obtustatin inhibiting the binding of this integrin to collagen IV.
P0C6R5	52	Disintegrin multisquamatin	?	?	Echis multisquamatus	Central Asian sand viper	Inhibits ADP-induced human, canine and rabbit platelet aggregation by binding with high affinity to alpha-IIb/beta-3 (ITGA2B/ITGB3).
P0C6S4	49	Disintegrin eristostatin	?	?	Eristicophis macmahoni	Leaf-nosed viper	Is a potent inhibitor of ADP-induced platelet aggregation. Acts by binding to alpha-IIb/beta-3 (ITGA2B/ITGB3) receptor on the platelet surface. Binds with the same high affinity to resting and activated platelets. Also binds the alpha-4/beta-1 (ITGA4/ITGB1) integrin. Is a potent inhibitor of human and murine melanoma metastases in mouse model systems, also due to the inhibition of binding between the alpha-4/beta-1 integrin and the vascular cell adhesion protein VCAM1. Reacts neither with the integrin alpha-V/beta-3 (ITGAV/ITGB3) vitronectin receptor nor with the integrin alpha-5/beta-1 (ITGA5/ITGB1) fibronectin receptor. Has no effect on cell proliferation or angiogenesis. Specifically inhibits cell migration on fibronectin, but not that on collagen IV or laminin. May involve fibronectin-binding integrins that mediate cell migration.
P0C7X7	73	Disintegrin mojastin-2	?	?	Crotalus scutulatus scutulatus	Mojave rattlesnake	Disintegrin mojastin-1: Inhibits the three processes involved in platelet function (adhesion, activation and aggregation). It inhibits platelet adhesion to fibronectin with an IC(50) of 58.6 nM. It inhibits ATP release from platelet induced by ADP with an IC(50) of 19.5 nM on platelet-rich plasma, probably by binding to ADP receptors (P2RY1 and P2RY12). Finally, it inhibits ADP-induced platelet aggregation with IC(50) of 44.7 nM on platelet-rich plasma and 19.3 nM on whole blood, probably by binding to alpha-IIb/beta-3 (ITGA2B/ITGB3) (PubMed:20598348). Disintegrin mojastin-2: Inhibits ADP-induced platelet aggregation (IC(50) = 13.8 nM) probably by binding to alpha-IIb/beta-3 (ITGA2B/ITGB3) located on the platelet surface.
P0DM87	484	Zinc metalloproteinase-disintegrin stejnitin	Snake venom metalloproteinase (SVMP)	?	Trimeresurus stejnegeri	Chinese green tree viper	Snake venom zinc metalloproteinase that inhibits ADP-induced platelet aggregation in human platelet-rich plasma (IC(50) is 175 nM) and cleaves alpha-(FGA) and subsequently the beta-chain (FGG) of bovine fibrinogen, leaving the gamma-chain unaffected. It is also able to inhibit proliferatin of ECV304 cells by inducing apoptosis of these cells.
P10451	314	Osteopontin	Bone sialoprotein 1 / Nephropontin / Secreted phosphoprotein 1 (SPP-1) / Urinary stone protein / Uropontin	SPP1	Homo sapiens	Human	Major non-collagenous bone protein that binds tightly to hydroxyapatite. Appears to form an integral part of the mineralized matrix. Probably important to cell-matrix interaction. Acts as a cytokine involved in enhancing production of interferon-gamma and interleukin-12 and reducing production of interleukin-10 and is essential in the pathway that leads to type I immunity.
P10600	412	Transforming growth factor beta-3 proprotein	?	TGFB3	Homo sapiens	Human	Transforming growth factor beta-3 proprotein: Precursor of the Latency-associated peptide (LAP) and Transforming growth factor beta-3 (TGF-beta-3) chains, which constitute the regulatory and active subunit of TGF-beta-3, respectively. Latency-associated peptide: Required to maintain the Transforming growth factor beta-3 (TGF-beta-3) chain in a latent state during storage in extracellular matrix (By similarity). Associates non-covalently with TGF-beta-3 and regulates its activation via interaction with 'milieu molecules', such as LTBP1 and LRRC32/GARP, that control activation of TGF-beta-3 (By similarity). Interaction with integrins results in distortion of the Latency-associated peptide chain and subsequent release of the active TGF-beta-3 (By similarity). Transforming growth factor beta-3: Multifunctional protein that regulates embryogenesis and cell differentiation and is required in various processes such as secondary palate development (By similarity). Activation into mature form follows different steps: following cleavage of the proprotein in the Golgi apparatus, Latency-associated peptide (LAP) and Transforming growth factor beta-3 (TGF-beta-3) chains remain non-covalently linked rendering TGF-beta-3 inactive during storage in extracellular matrix (By similarity). At the same time, LAP chain interacts with 'milieu molecules', such as LTBP1 and LRRC32/GARP that control activation of TGF-beta-3 and maintain it in a latent state during storage in extracellular milieus (By similarity). TGF-beta-3 is released from LAP by integrins: integrin-binding results in distortion of the LAP chain and subsequent release of the active TGF-beta-3 (By similarity). Once activated following release of LAP, TGF-beta-3 acts by binding to TGF-beta receptors (TGFBR1 and TGFBR2), which transduce signal (By similarity).
P11047	1609	Laminin subunit gamma-1	Laminin B2 chain / Laminin-1 subunit gamma / Laminin-10 subunit gamma / Laminin-11 subunit gamma / Laminin-2 subunit gamma / Laminin-3 subunit gamma / Laminin-4 subunit gamma / Laminin-6 subunit gamma / Laminin-7 subunit gamma / Laminin-8 subunit gamma / Laminin-9 subunit gamma / S-laminin subunit gamma (S-LAM gamma)	LAMC1	Homo sapiens	Human	Binding to cells via a high affinity receptor, laminin is thought to mediate the attachment, migration and organization of cells into tissues during embryonic development by interacting with other extracellular matrix components.
P11922	985	Invasin	?	YPTB1668	Yersinia pseudotuberculosis serotype I (strain IP32953)	?	Invasin is a protein that allows enteric bacteria to penetrate cultured mammalian cells. The entry of invasin in the cell is mediated by binding several beta-1 chain integrins.
P12255	3590	Filamentous hemagglutinin	?	fhaB	Bordetella pertussis (strain Tohama I / ATCC BAA-589 / NCTC 13251)	?	Evidence for a role in host-cell binding and infection.
P13839	320	Bone sialoprotein 2	Bone sialoprotein II (BSP II) / Cell-binding sialoprotein / Integrin-binding sialoprotein	Ibsp	Rattus norvegicus	Rat	Binds tightly to hydroxyapatite. Appears to form an integral part of the mineralized matrix. Probably important to cell-matrix interaction. Promotes Arg-Gly-Asp-dependent cell attachment.
P14530	478	Zinc metalloproteinase/disintegrin	?	?	Protobothrops flavoviridis	Habu	Snake venom metalloproteinase HR2a: Zinc protease that induces hemorrhage. Disintegrin flavostatin: Inhibits platelet aggregation induced by ADP, thrombin, and collagen. Acts by inhibiting fibrinogen interaction with platelet receptors GPIIb/GPIIIa (ITGA2B/ITGB3).
P14543	1247	Nidogen-1	Entactin	NID1	Homo sapiens	Human	Sulfated glycoprotein widely distributed in basement membranes and tightly associated with laminin. Also binds to collagen IV and perlecan. It probably has a role in cell-extracellular matrix interactions.
P14555	144	Phospholipase A2, membrane associated	GIIC sPLA2 / Group IIA phospholipase A2 / Non-pancreatic secretory phospholipase A2 (NPS-PLA2) / Phosphatidylcholine 2-acylhydrolase 2A	PLA2G2A	Homo sapiens	Human	Secretory calcium-dependent phospholipase A2 that primarily targets extracellular phospholipids with implications in host antimicrobial defense, inflammatory response and tissue regeneration (PubMed:10455175, PubMed:10681567, PubMed:2925633). Hydrolyzes the ester bond of the fatty acyl group attached at sn-2 position of phospholipids (phospholipase A2 activity) with preference for phosphatidylethanolamines and phosphatidylglycerols over phosphatidylcholines (PubMed:10455175, PubMed:10681567). Contributes to lipid remodeling of cellular membranes and generation of lipid mediators involved in pathogen clearance. Displays bactericidal activity against Gram-positive bacteria by directly hydrolyzing phospholipids of the bacterial membrane (PubMed:11694541, PubMed:10358193). Upon sterile inflammation, targets membrane phospholipids of extracellular mitochondria released from activated platelets, generating free unsaturated fatty acids such as arachidonate that is used by neighboring leukocytes to synthesize inflammatory eicosanoids such as leukotrienes. Simultaneously, by compromising mitochondrial membrane integrity, promotes the release in circulation of potent damage-associated molecular pattern molecules that activate the innate immune response (PubMed:25082876). Plays a stem cell regulator role in the intestinal crypt. Within intracellular compartment mediates Paneth cell differentiation and its stem cell supporting functions by inhibiting Wnt signaling pathway in intestinal stem cell (ICS). Secreted in the intestinal lumen upon inflammation, acts in an autocrine way and promotes prostaglandin E2 synthesis that stimulates Wnt signaling pathway in ICS cells and tissue regeneration (By similarity). May play a role in the biosynthesis of N-acyl ethanolamines that regulate energy metabolism and inflammation. Hydrolyzes N-acyl phosphatidylethanolamines to N-acyl lysophosphatidylethanolamines, which are further cleaved by a lysophospholipase D to release N-acyl ethanolamines (PubMed:14998370). Independent of its catalytic activity, acts as a ligand for integrins (PubMed:18635536, PubMed:25398877). Binds to and activates integrins ITGAV:ITGB3, ITGA4:ITGB1 and ITGA5:ITGB1 (PubMed:18635536, PubMed:25398877). Binds to a site (site 2) which is distinct from the classical ligand-binding site (site 1) and induces integrin conformational changes and enhanced ligand binding to site 1 (PubMed:25398877). Induces cell proliferation in an integrin-dependent manner (PubMed:18635536).
P15503	480	Zinc metalloproteinase/disintegrin	?	?	Trimeresurus gramineus	Bamboo pit viper	Snake venom metalloproteinase: Impairs hemostasis in the envenomed animal. Disintegrin trigramin-alpha: Inhibits platelet aggregation induced by ADP, thrombin, platelet-activating factor and collagen. Acts by inhibiting fibrinogen interaction with platelet receptors GPIIb/GPIIIa (ITGA2B/ITGB3).
P17347	186	Disintegrin metalloproteinase/disintegrin echistatin	?	?	Echis carinatus sochureki	Saw-scaled viper	Snake venom metalloproteinase: Impairs hemostasis in the envenomed animal. Disintegrin echistatin: Potent inhibitor of ligand binding to the integrins alpha-V/beta-3 (ITGAV/ITGB3) (IC(50)=20.7 nM), alpha-IIb/beta-3 (ITGA2B/ITGB3) (IC(50)=51.5 nM), alpha-5/beta-1 (ITGA5/ITGB1) (IC(50)=132.6 nM), and moderate inhibitor of ligand binding to the integrin alpha-V/beta-5 (ITGAV/ITGB5) (IC(50)=286.4 nM) (PubMed:9269775, PubMed:33182321). Competition with fibrinogen for the RGD recognition sites on the alpha-IIb/beta-3 integrin (glyco-protein IIb/IIIa complex) results in the inhibition of platelet aggregation and other antithrombotic properties such as an ability to prevent coronary thrombosis in animal models (PubMed:3198653, PubMed:2320569) (Probable). Is also a potent inhibitor of bone resorption. This results from the blocking of the interaction of alpha-V/beta-3 integrin on the surface of osteoclasts with bone extracellular matrix (Probable). In addition, interaction with alpha-V/beta-3 also inhibits human umbilical vein endothelial cells (HUVEC) proliferation (IC(50)=103.2 nM) and inhibits the migration of some tumor cells (IC(50)=1.5-154.5 nM), suggesting that this disintegrin could be a good scaffold to design potent antiangiogenic agents by modifying its unique C-terminal tail structure (Probable) (PubMed:33182321).
P17349	481	Zinc metalloproteinase/disintegrin	?	?	Protobothrops elegans	Elegant pitviper	Snake venom metalloproteinase: Impairs hemostasis in the envenomed animal. Disintegrin elegantin-1a: Inhibits platelet aggregation induced by ADP, thrombin, platelet-activating factor and collagen. Acts by inhibiting fibrinogen interaction with platelet receptors GPIIb/GPIIIa (ITGA2B/ITGB3).
P17495	73	Disintegrin trigramin-beta-2	Platelet aggregation activation inhibitor	?	Trimeresurus gramineus	Bamboo pit viper	Inhibits fibrinogen interaction with platelets. Acts by binding to the alpha-IIb/beta-3 receptor (ITGA2B/ITGB3) on the platelet surface and inhibits aggregation induced by ADP, thrombin, platelet-activating factor and collagen.
P17497	83	Disintegrin bitistatin	Arietin / Bitan-alpha / Bitistatin D1 / Platelet aggregation activation inhibitor / Venom protein CM-2	?	Bitis arietans	African puff adder	Inhibits fibrinogen interaction with platelets. Acts by binding to alpha-IIb/beta-3 (ITGA2B/ITGB3) on the platelet surface and inhibits aggregation induced by ADP, thrombin, platelet-activating factor and collagen.
P17813	658	Endoglin	?	ENG	Homo sapiens	Human	Vascular endothelium glycoprotein that plays an important role in the regulation of angiogenesis (PubMed:21737454, PubMed:23300529). Required for normal structure and integrity of adult vasculature (PubMed:7894484). Regulates the migration of vascular endothelial cells (PubMed:17540773). Required for normal extraembryonic angiogenesis and for embryonic heart development (By similarity). May regulate endothelial cell shape changes in response to blood flow, which drive vascular remodeling and establishment of normal vascular morphology during angiogenesis (By similarity). May play a critical role in the binding of endothelial cells to integrins and/or other RGD receptors (PubMed:1692830). Acts as TGF-beta coreceptor and is involved in the TGF-beta/BMP signaling cascade that ultimately leads to the activation of SMAD transcription factors (PubMed:8370410, PubMed:21737454, PubMed:22347366, PubMed:23300529). Required for GDF2/BMP9 signaling through SMAD1 in endothelial cells and modulates TGFB1 signaling through SMAD3 (PubMed:21737454, PubMed:22347366, PubMed:23300529).
P18065	325	Insulin-like growth factor-binding protein 2	?	IGFBP2	Homo sapiens	Human	Inhibits IGF-mediated growth and developmental rates. IGF-binding proteins prolong the half-life of the IGFs and have been shown to either inhibit or stimulate the growth promoting effects of the IGFs on cell culture. They alter the interaction of IGFs with their cell surface receptors.
P18618	72	Disintegrin batroxostatin	Disintegrin colombistatin / Platelet aggregation activation inhibitor	?	Bothrops atrox	Barba amarilla	Inhibits fibrinogen interaction with platelets. Acts by binding to the glycoprotein IIb-IIIa receptor (ITGA2B/ITGB3) on the platelet surface and inhibits aggregation induced by ADP, thrombin, platelet-activating factor and collagen. Also inhibits T24 and SK-Mel-28 cell adhesion to fibronectin with IC(50) of 4.4 uM and 33 nM, respectively.
P18619	483	Zinc metalloproteinase/disintegrin	?	?	Protobothrops flavoviridis	Habu	Snake venom metalloproteinase: Impairs hemostasis in the envenomed animal. Disintegrin flavoridin: Inhibits platelet aggregation induced by ADP, thrombin, platelet-activating factor and collagen. Acts by inhibiting fibrinogen interaction with platelet receptors GPIIb/GPIIIa (ITGA2B/ITGB3) (By similarity).
P19137	3083	Laminin subunit alpha-1	Laminin A chain / Laminin-1 subunit alpha / Laminin-3 subunit alpha / S-laminin subunit alpha (S-LAM alpha)	Lama1	Mus musculus	Mouse	Binding to cells via a high affinity receptor, laminin is thought to mediate the attachment, migration and organization of cells into tissues during embryonic development by interacting with other extracellular matrix components.
P19320	739	Vascular cell adhesion protein 1	INCAM-100	VCAM1	Homo sapiens	Human	Important in cell-cell recognition. Appears to function in leukocyte-endothelial cell adhesion. Interacts with integrin alpha-4/beta-1 (ITGA4/ITGB1) on leukocytes, and mediates both adhesion and signal transduction. The VCAM1/ITGA4/ITGB1 interaction may play a pathophysiologic role both in immune responses and in leukocyte emigration to sites of inflammation.
