#Accession	Length	Protein_name	Protein_name_alternative	Gene_name	Organism_scientific	Organism_common	Function
C0HJM4	71	Disintegrin simusmin	?	?	Crotalus simus	Central American rattlesnake	Inhibits ADP- (IC(50)=56 nM) and collagen-induced (IC(50)=49 nM) aggregation of human platelets. In vitro, inhibits adhesion of endothelial cells to vitronectin, type-I collagen and, to a lower degree, fibronectin and laminin.
C0HJM5	72	Disintegrin sasaimin	?	?	Cerrophidion sasai	Costa Rica montane pitviper	Inhibits ADP- (IC(50)=66 nM) and collagen-induced (IC(50)=100 nM) aggregation of human platelets. In vitro, inhibits adhesion of endothelial cells to vitronectin, type-I collagen and, to a lower degree, fibronectin and laminin.
C0HK50	71	Disintegrin tzabcanin	?	?	Crotalus tzabcan	Yucatan neotropical rattlesnake	Inhibits fibrinogen interaction with platelets. Acts by binding to alpha-IIb/beta-3 (ITGA2B/ITGB3) on the platelet surface and inhibits aggregation induced by ADP, thrombin, platelet-activating factor and collagen (By similarity). Inhibits cell adhesion to vitronectin, probably by blocking its receptor integrin alpha-V/beta-3 (ITGAV/ITGB3), and to fibronectin in vitro (PubMed:26163300, PubMed:27060015). Shows little to no cytotoxicity in vitro (PubMed:26163300, PubMed:27060015).
C9E1R9	478	Zinc metalloproteinase/disintegrin VMP-II	?	?	Crotalus viridis viridis	Prairie rattlesnake	Snake venom metalloproteinase: Impairs hemostasis in the envenomed animal. Disintegrin viridistatin-2: This recombinant protein inhibits ADP-induced platelet aggregation in whole human blood and this effect is concentration-dependent with an IC(50) of 34 nM.
D2YW39	135	Snaclec rhodocetin subunit gamma	?	?	Calloselasma rhodostoma	Malayan pit viper	Potent inhibitor of collagen-induced platelet aggregation. It acts by binding to the integrin alpha2A domain and blocks collagen binding to integrin alpha-2/beta-1 (ITGA2/ITGB1). The gamma/delta subunits mainly contribute to this activity.
D2YW40	124	Snaclec rhodocetin subunit delta	?	?	Calloselasma rhodostoma	Malayan pit viper	Potent inhibitor of collagen-induced platelet aggregation. It acts by binding to the integrin alpha2A domain and blocks collagen binding to integrin alpha-2/beta-1 (ITGA2/ITGB1). The gamma/delta subunits mainly contribute to this activity.
E9NW27	484	Zinc metalloproteinase/disintegrin PMMP-2	?	?	Protobothrops mucrosquamatus	Taiwan habu	Snake venom metalloproteinase: Impairs hemostasis in the envenomed animal. Disintegrin trimucrin: Inhibits platelet aggregation induced by ADP, thrombin, platelet-activating factor and collagen. Acts by inhibiting fibrinogen interaction with platelet receptors GPIIb/GPIIIa (ITGA2B/ITGB3).
J9Z332	488	Zinc metalloproteinase-disintegrin VMP-II	Disintegrin r-Cam-dis / Snake venom metalloproteinase (SVMP)	?	Crotalus adamanteus	Eastern diamondback rattlesnake	Zinc metalloproteinase-disintegrin VMP-II: inhibits ADP-induced platelet aggregation (probably by binding integrin alpha-IIb/beta-3 (ITGA2B/ITGB3)) and degrades fibrinogen. Recombinant disintegrin r-Cam-dis (413-488): this recombinant protein inhibits platelet adhesion to fibrinogen (IC(50) is 1 nM), inhibits collagen- (IC(50) is 18 nM) and ADP-induced (IC(50) is 6 nM) platelet aggregation, and also inhibits platelet function on clot retraction. May act by binding integrin alpha-IIb/beta-3 (ITGA2B/ITGB3).
O15230	3695	Laminin subunit alpha-5	Laminin-10 subunit alpha / Laminin-11 subunit alpha / Laminin-15 subunit alpha	LAMA5	Homo sapiens	Human	Binding to cells via a high affinity receptor, laminin is thought to mediate the attachment, migration and organization of cells into tissues during embryonic development by interacting with other extracellular matrix components.
O18977	4135	Tenascin-X	?	TN-X	Bos taurus	Bovine	?
O25272	237	Cag pathogenicity island protein (Cag18)	?	HP_0539	Helicobacter pylori (strain ATCC 700392 / 26695)	?	?
O35474	480	EGF-like repeat and discoidin I-like domain-containing protein 3	Developmentally-regulated endothelial cell locus 1 protein / Integrin-binding protein DEL1	Edil3	Mus musculus	Mouse	Promotes adhesion of endothelial cells through interaction with the alpha-v/beta-3 integrin receptor. Inhibits formation of vascular-like structures. May be involved in regulation of vascular morphogenesis of remodeling in embryonic development.
O43827	346	Angiopoietin-related protein 7	Angiopoietin-like factor / Angiopoietin-like protein 7 / Cornea-derived transcript 6 protein	ANGPTL7	Homo sapiens	Human	Has a role in the formation and organization of the extracellular matrix. In the eye, it functions as a mediator of dexamethasone-induced matrix deposition in the trabecular meshwork, the tissue responsible for the outflow of the ocular aqueous humor and for the maintenance of intraocular pressure (PubMed:21199193). Is a negative regulator of angiogenesis in the cornea, and plays a major role in maintaining corneal avascularity and transparency (PubMed:25622036).
O43854	480	EGF-like repeat and discoidin I-like domain-containing protein 3	Developmentally-regulated endothelial cell locus 1 protein / Integrin-binding protein DEL1	EDIL3	Homo sapiens	Human	Promotes adhesion of endothelial cells through interaction with the alpha-v/beta-3 integrin receptor. Inhibits formation of vascular-like structures. May be involved in regulation of vascular morphogenesis of remodeling in embryonic development.
O93515	146	Zinc metalloproteinase-disintegrin salmosin-3	Snake venom metalloproteinase (SVMP)	?	Gloydius brevicaudus	Korean slamosa snake	Snake venom zinc metalloproteinase that inhibits ADP-induced platelet aggregation (probably by binding integrin alpha-IIb/beta-3 (ITGA2B/ITGB3)) and degrades fibrinogen.
O95631	604	Netrin-1	Epididymis tissue protein Li 131P	NTN1	Homo sapiens	Human	Netrins control guidance of CNS commissural axons and peripheral motor axons. Its association with either DCC or some UNC5 receptors will lead to axon attraction or repulsion, respectively. Binding to UNC5C might cause dissociation of UNC5C from polymerized TUBB3 in microtubules and thereby lead to increased microtubule dynamics and axon repulsion (PubMed:28483977). Involved in dorsal root ganglion axon projection towards the spinal cord (PubMed:28483977). It also serves as a survival factor via its association with its receptors which prevent the initiation of apoptosis. Involved in tumorigenesis by regulating apoptosis (PubMed:15343335).
P00450	1065	Ceruloplasmin	Ferroxidase	CP	Homo sapiens	Human	Ceruloplasmin is a blue, copper-binding (6-7 atoms per molecule) glycoprotein. It has ferroxidase activity oxidizing Fe(2+) to Fe(3+) without releasing radical oxygen species. It is involved in iron transport across the cell membrane. Provides Cu(2+) ions for the ascorbate-mediated deaminase degradation of the heparan sulfate chains of GPC1. May also play a role in fetal lung development or pulmonary antioxidant defense (By similarity).
P00734	622	Prothrombin	Coagulation factor II	F2	Homo sapiens	Human	Thrombin, which cleaves bonds after Arg and Lys, converts fibrinogen to fibrin and activates factors V, VII, VIII, XIII, and, in complex with thrombomodulin, protein C. Functions in blood homeostasis, inflammation and wound healing.
P01024	1663	Complement C3	C3 and PZP-like alpha-2-macroglobulin domain-containing protein 1	C3	Homo sapiens	Human	C3 plays a central role in the activation of the complement system. Its processing by C3 convertase is the central reaction in both classical and alternative complement pathways. After activation C3b can bind covalently, via its reactive thioester, to cell surface carbohydrates or immune aggregates. Derived from proteolytic degradation of complement C3, C3a anaphylatoxin is a mediator of local inflammatory process. In chronic inflammation, acts as a chemoattractant for neutrophils (By similarity). It induces the contraction of smooth muscle, increases vascular permeability and causes histamine release from mast cells and basophilic leukocytes. C3-beta-c: Acts as a chemoattractant for neutrophils in chronic inflammation. Acylation stimulating protein: Adipogenic hormone that stimulates triglyceride (TG) synthesis and glucose transport in adipocytes, regulating fat storage and playing a role in postprandial TG clearance. Appears to stimulate TG synthesis via activation of the PLC, MAPK and AKT signaling pathways. Ligand for C5AR2. Promotes the phosphorylation, ARRB2-mediated internalization and recycling of C5AR2 (PubMed:8376604, PubMed:2909530, PubMed:9059512, PubMed:10432298, PubMed:15833747, PubMed:16333141, PubMed:19615750).
P01137	390	Transforming growth factor beta-1 proprotein	?	TGFB1	Homo sapiens	Human	Transforming growth factor beta-1 proprotein: Precursor of the Latency-associated peptide (LAP) and Transforming growth factor beta-1 (TGF-beta-1) chains, which constitute the regulatory and active subunit of TGF-beta-1, respectively. Latency-associated peptide: Required to maintain the Transforming growth factor beta-1 (TGF-beta-1) chain in a latent state during storage in extracellular matrix (PubMed:28117447). Associates non-covalently with TGF-beta-1 and regulates its activation via interaction with 'milieu molecules', such as LTBP1, LRRC32/GARP and LRRC33/NRROS, that control activation of TGF-beta-1 (PubMed:2022183, PubMed:8617200, PubMed:8939931, PubMed:19750484, PubMed:22278742, PubMed:19651619). Interaction with LRRC33/NRROS regulates activation of TGF-beta-1 in macrophages and microglia (Probable). Interaction with LRRC32/GARP controls activation of TGF-beta-1 on the surface of activated regulatory T-cells (Tregs) (PubMed:19750484, PubMed:22278742, PubMed:19651619). Interaction with integrins (ITGAV:ITGB6 or ITGAV:ITGB8) results in distortion of the Latency-associated peptide chain and subsequent release of the active TGF-beta-1 (PubMed:22278742, PubMed:28117447). Transforming growth factor beta-1: Multifunctional protein that regulates the growth and differentiation of various cell types and is involved in various processes, such as normal development, immune function, microglia function and responses to neurodegeneration (By similarity). Activation into mature form follows different steps: following cleavage of the proprotein in the Golgi apparatus, Latency-associated peptide (LAP) and Transforming growth factor beta-1 (TGF-beta-1) chains remain non-covalently linked rendering TGF-beta-1 inactive during storage in extracellular matrix (PubMed:29109152). At the same time, LAP chain interacts with 'milieu molecules', such as LTBP1, LRRC32/GARP and LRRC33/NRROS that control activation of TGF-beta-1 and maintain it in a latent state during storage in extracellular milieus (PubMed:2022183, PubMed:8617200, PubMed:8939931, PubMed:19750484, PubMed:22278742, PubMed:19651619). TGF-beta-1 is released from LAP by integrins (ITGAV:ITGB6 or ITGAV:ITGB8): integrin-binding to LAP stabilizes an alternative conformation of the LAP bowtie tail and results in distortion of the LAP chain and subsequent release of the active TGF-beta-1 (PubMed:22278742, PubMed:28117447). Once activated following release of LAP, TGF-beta-1 acts by binding to TGF-beta receptors (TGFBR1 and TGFBR2), which transduce signal (PubMed:20207738). While expressed by many cells types, TGF-beta-1 only has a very localized range of action within cell environment thanks to fine regulation of its activation by Latency-associated peptide chain (LAP) and 'milieu molecules' (By similarity). Plays an important role in bone remodeling: acts as a potent stimulator of osteoblastic bone formation, causing chemotaxis, proliferation and differentiation in committed osteoblasts (By similarity). Can promote either T-helper 17 cells (Th17) or regulatory T-cells (Treg) lineage differentiation in a concentration-dependent manner (By similarity). At high concentrations, leads to FOXP3-mediated suppression of RORC and down-regulation of IL-17 expression, favoring Treg cell development (By similarity). At low concentrations in concert with IL-6 and IL-21, leads to expression of the IL-17 and IL-23 receptors, favoring differentiation to Th17 cells (By similarity). Stimulates sustained production of collagen through the activation of CREB3L1 by regulated intramembrane proteolysis (RIP) (PubMed:25310401). Mediates SMAD2/3 activation by inducing its phosphorylation and subsequent translocation to the nucleus (PubMed:25893292, PubMed:29483653, PubMed:30696809). Can induce epithelial-to-mesenchymal transition (EMT) and cell migration in various cell types (PubMed:25893292, PubMed:30696809).
P01574	187	Interferon beta	Fibroblast interferon	IFNB1	Homo sapiens	Human	Has antiviral, antibacterial and anticancer activities.
P01584	269	Interleukin-1 beta	Catabolin	IL1B	Homo sapiens	Human	Potent pro-inflammatory cytokine (PubMed:3920526, PubMed:10653850, PubMed:12794819). Initially discovered as the major endogenous pyrogen, induces prostaglandin synthesis, neutrophil influx and activation, T-cell activation and cytokine production, B-cell activation and antibody production, and fibroblast proliferation and collagen production (PubMed:3920526). Promotes Th17 differentiation of T-cells. Synergizes with IL12/interleukin-12 to induce IFNG synthesis from T-helper 1 (Th1) cells (PubMed:10653850). Plays a role in angiogenesis by inducing VEGF production synergistically with TNF and IL6 (PubMed:12794819). Involved in transduction of inflammation downstream of pyroptosis: its mature form is specifically released in the extracellular milieu by passing through the gasdermin-D (GSDMD) pore (PubMed:33377178, PubMed:33883744).
P02452	1464	Collagen alpha-1(I) chain	Alpha-1 type I collagen	COL1A1	Homo sapiens	Human	Type I collagen is a member of group I collagen (fibrillar forming collagen).
P02453	1463	Collagen alpha-1(I) chain	Alpha-1 type I collagen	COL1A1	Bos taurus	Bovine	Type I collagen is a member of group I collagen (fibrillar forming collagen).
P02458	1487	Collagen alpha-1(II) chain	Alpha-1 type II collagen	COL2A1	Homo sapiens	Human	Type II collagen is specific for cartilaginous tissues. It is essential for the normal embryonic development of the skeleton, for linear growth and for the ability of cartilage to resist compressive forces.
P02462	1669	Collagen alpha-1(IV) chain	?	COL4A1	Homo sapiens	Human	Type IV collagen is the major structural component of glomerular basement membranes (GBM), forming a 'chicken-wire' meshwork together with laminins, proteoglycans and entactin/nidogen. Arresten, comprising the C-terminal NC1 domain, inhibits angiogenesis and tumor formation. The C-terminal half is found to possess the anti-angiogenic activity. Specifically inhibits endothelial cell proliferation, migration and tube formation.
P02468	1607	Laminin subunit gamma-1	Laminin B2 chain / Laminin-1 subunit gamma / Laminin-10 subunit gamma / Laminin-11 subunit gamma / Laminin-2 subunit gamma / Laminin-3 subunit gamma / Laminin-4 subunit gamma / Laminin-6 subunit gamma / Laminin-7 subunit gamma / Laminin-8 subunit gamma / Laminin-9 subunit gamma / S-laminin subunit gamma (S-LAM gamma)	Lamc1	Mus musculus	Mouse	Binding to cells via a high affinity receptor, laminin is thought to mediate the attachment, migration and organization of cells into tissues during embryonic development by interacting with other extracellular matrix components.
P02469	1786	Laminin subunit beta-1	Laminin B1 chain / Laminin-1 subunit beta / Laminin-10 subunit beta / Laminin-12 subunit beta / Laminin-2 subunit beta / Laminin-6 subunit beta / Laminin-8 subunit beta	Lamb1	Mus musculus	Mouse	Binding to cells via a high affinity receptor, laminin is thought to mediate the attachment, migration and organization of cells into tissues during embryonic development by interacting with other extracellular matrix components. Involved in the organization of the laminar architecture of the cerebral cortex (By similarity). It is probably required for the integrity of the basement membrane/glia limitans that serves as an anchor point for the endfeet of radial glial cells and as a physical barrier to migrating neurons (By similarity). Radial glial cells play a central role in cerebral cortical development, where they act both as the proliferative unit of the cerebral cortex and a scaffold for neurons migrating toward the pial surface (By similarity).
P02679-2	453	Fibrinogen gamma chain	?	FGG	Homo sapiens	Human	Together with fibrinogen alpha (FGA) and fibrinogen beta (FGB), polymerizes to form an insoluble fibrin matrix. Has a major function in hemostasis as one of the primary components of blood clots. In addition, functions during the early stages of wound repair to stabilize the lesion and guide cell migration during re-epithelialization. Was originally thought to be essential for platelet aggregation, based on in vitro studies using anticoagulated blood. However, subsequent studies have shown that it is not absolutely required for thrombus formation in vivo. Enhances expression of SELP in activated platelets via an ITGB3-dependent pathway. Maternal fibrinogen is essential for successful pregnancy. Fibrin deposition is also associated with infection, where it protects against IFNG-mediated hemorrhage. May also facilitate the antibacterial immune response via both innate and T-cell mediated pathways.
P02751	2477	Fibronectin	Cold-insoluble globulin (CIG)	FN1	Homo sapiens	Human	Fibronectins bind cell surfaces and various compounds including collagen, fibrin, heparin, DNA, and actin (PubMed:3024962, PubMed:3900070, PubMed:3593230, PubMed:7989369). Fibronectins are involved in cell adhesion, cell motility, opsonization, wound healing, and maintenance of cell shape (PubMed:3024962, PubMed:3900070, PubMed:3593230, PubMed:7989369). Involved in osteoblast compaction through the fibronectin fibrillogenesis cell-mediated matrix assembly process, essential for osteoblast mineralization (By similarity). Participates in the regulation of type I collagen deposition by osteoblasts (By similarity). Acts as a ligand for the LILRB4 receptor, inhibiting FCGR1A/CD64-mediated monocyte activation (PubMed:34089617). Anastellin: Binds fibronectin and induces fibril formation. This fibronectin polymer, named superfibronectin, exhibits enhanced adhesive properties. Both anastellin and superfibronectin inhibit tumor growth, angiogenesis and metastasis. Anastellin activates p38 MAPK and inhibits lysophospholipid signaling.
P03308	2333	Genome polyprotein	?	?	Foot-and-mouth disease virus (isolate Bovine/United Kingdom/A12Valle119/1932 serotype A)	FMDV	Leader protease: Autocatalytically cleaves itself from the polyprotein at the L/VP0 junction. Cleaves also the host translation initiation factors EIF4G1 and EIF4G3, in order to shutoff the capped cellular mRNA transcription. Plays a role in counteracting host innate antiviral response using diverse mechanisms. Possesses a deubiquitinase activity acting on both 'Lys'-48 and 'Lys'-63-linked polyubiquitin chains. In turn, inhibits the ubiquitination and subsequent activation of key signaling molecules of type I IFN response such as host DDX58, TBK1, TRAF3 and TRAF6. Inhibits host NF-kappa-B activity by inducing a decrease in RELA mRNA levels. Cleaves a peptide bond in the C-terminus of host ISG15, resulting in the damaging of this mofidier that can no longer be attached to target proteins. Cleaves also host G3BP1 and G3BP2 in order to inhibit cytoplasmic stress granules assembly (PubMed:30404792). Capsid protein VP4: Lies on the inner surface of the capsid shell. After binding to the host receptor, the capsid undergoes conformational changes. Capsid protein VP4 is released, capsid protein VP1 N-terminus is externalized, and together, they shape a pore in the host membrane through which the viral genome is translocated into the host cell cytoplasm. After genome has been released, the channel shrinks. Capsid protein VP2: Forms an icosahedral capsid of pseudo T=3 symmetry with capsid proteins VP1 and VP3. The capsid is composed of 60 copies of each capsid protein organized in the form of twelve pentamers and encloses the viral positive strand RNA genome. Capsid protein VP1: Forms an icosahedral capsid of pseudo T=3 symmetry with capsid proteins VP2 and VP3. The capsid is composed of 60 copies of each capsid protein organized in the form of twelve pentamers and encloses the viral positive strand RNA genome. Mediates cell entry by attachment to an integrin receptor, usually host ITGAV/ITGB6. In addition, targets host MAVS to suppress type I IFN pathway. Capsid protein VP3: Forms an icosahedral capsid of pseudo T=3 symmetry with capsid proteins VP0 and VP3. The capsid is composed of 60 copies of each capsid protein organized in the form of twelve pentamers and encloses the viral positive strand RNA genome. Protein 2A: Mediates self-processing of the polyprotein by a translational effect termed 'ribosome skipping'. Mechanistically, 2A-mediated cleavage occurs between the C-terminal glycine and the proline of the downstream protein 2B. In the case of foot-and-mouth disease virus, the 2A oligopeptide is post-translationally 'trimmed' from the C-terminus of the upstream protein 1D by 3C proteinase. Protein 2B: Plays an essential role in the virus replication cycle by acting as a viroporin. Creates a pore in the host reticulum endoplasmic and as a consequence releases Ca2+ in the cytoplasm of infected cell. In turn, high levels of cytoplasmic calcium may trigger membrane trafficking and transport of viral ER-associated proteins to viroplasms, sites of viral genome replication. Protein 2C: Associates with and induces structural rearrangements of intracellular membranes. Triggers host autophagy by interacting with host BECN1 and thereby promotes viral replication. Participates in viral replication and interacts with host DHX9. Displays RNA-binding, nucleotide binding and NTPase activities. May play a role in virion morphogenesis and viral RNA encapsidation by interacting with the capsid protein VP3. Protein 3A: Plays important roles in virus replication, virulence and host range. Protein 3B-1: Covalently linked to the 5'-end of both the positive-strand and negative-strand genomic RNAs. Acts as a genome-linked replication primer. Protein 3B-2: Covalently linked to the 5'-end of both the positive-strand and negative-strand genomic RNAs. Acts as a genome-linked replication primer. Protein 3B-3: Covalently linked to the 5'-end of both the positive-strand and negative-strand genomic RNAs. Acts as a genome-linked replication primer. Protease 3C: Cysteine protease that generates mature viral proteins from the precursor polyprotein. In addition to its proteolytic activity, binds to viral RNA and thus influences viral genome replication. RNA and substrate bind cooperatively to the protease. RNA-directed RNA polymerase 3D-POL replicates genomic and antigenomic RNA by recognizing replications specific signals. Covalently attaches UMP to a tyrosine of VPg, which is used to prime RNA synthesis. The positive stranded RNA genome is first replicated at virus induced membranous vesicles, creating a dsRNA genomic replication form. This dsRNA is then used as template to synthesize positive stranded RNA genomes. ss(+)RNA genomes are either translated, replicated or encapsidated.
P04004	478	Vitronectin	S-protein / Serum-spreading factor / V75	VTN	Homo sapiens	Human	Vitronectin is a cell adhesion and spreading factor found in serum and tissues. Vitronectin interact with glycosaminoglycans and proteoglycans. Is recognized by certain members of the integrin family and serves as a cell-to-substrate adhesion molecule. Inhibitor of the membrane-damaging effect of the terminal cytolytic complement pathway. Somatomedin-B is a growth hormone-dependent serum factor with protease-inhibiting activity.
P04070	461	Vitamin K-dependent protein C	Anticoagulant protein C / Autoprothrombin IIA / Blood coagulation factor XIV	PROC	Homo sapiens	Human	Protein C is a vitamin K-dependent serine protease that regulates blood coagulation by inactivating factors Va and VIIIa in the presence of calcium ions and phospholipids (PubMed:25618265). Exerts a protective effect on the endothelial cell barrier function (PubMed:25651845).
P04258	1049	Collagen alpha-1(III) chain	?	COL3A1	Bos taurus	Bovine	Collagen type III occurs in most soft connective tissues along with type I collagen. Involved in regulation of cortical development. Is the major ligand of ADGRG1 in the developing brain and binding to ADGRG1 inhibits neuronal migration and activates the RhoA pathway by coupling ADGRG1 to GNA13 and possibly GNA12 (By similarity).
P04275	2813	von Willebrand factor	?	VWF	Homo sapiens	Human	Important in the maintenance of hemostasis, it promotes adhesion of platelets to the sites of vascular injury by forming a molecular bridge between sub-endothelial collagen matrix and platelet-surface receptor complex GPIb-IX-V. Also acts as a chaperone for coagulation factor VIII, delivering it to the site of injury, stabilizing its heterodimeric structure and protecting it from premature clearance from plasma.
